{
  "schemaVersion": "star-cluster-tl1-weapon-matrix-v1",
  "id": "tl1-wm01-complete-weapon-matrix",
  "baselineSha256": "cff1b6caca7eb4d32d08a140fba3c645d98c1275ef13b4185f830dccfbd49d19",
  "masterSeed": 290100,
  "trialsPerVariant": 10000,
  "variants": [
    {
      "id": "wm-kk-r0",
      "label": "kinetic mirror range 0",
      "rangeHexes": 0,
      "sideA": {
        "family": "kinetic",
        "doctrine": "standard",
        "accuracy": 20,
        "computerBonus": 10,
        "evasive": false,
        "reactorOutput": 5,
        "ammunition": 100,
        "missileGuidance": 55,
        "missileDamage": 5,
        "missileShieldPenetration": 1,
        "missileArmorPenetration": 2,
        "missileSpeed": 1,
        "missileRange": 6,
        "targetMovePerTurn": 0
      },
      "sideB": {
        "family": "kinetic",
        "doctrine": "standard",
        "accuracy": 20,
        "computerBonus": 10,
        "evasive": false,
        "reactorOutput": 5,
        "ammunition": 100,
        "missileGuidance": 55,
        "missileDamage": 5,
        "missileShieldPenetration": 1,
        "missileArmorPenetration": 2,
        "missileSpeed": 1,
        "missileRange": 6,
        "targetMovePerTurn": 0
      }
    },
    {
      "id": "wm-kk-r2",
      "label": "kinetic mirror range 2",
      "rangeHexes": 2,
      "sideA": {
        "family": "kinetic",
        "doctrine": "standard",
        "accuracy": 20,
        "computerBonus": 10,
        "evasive": false,
        "reactorOutput": 5,
        "ammunition": 100,
        "missileGuidance": 55,
        "missileDamage": 5,
        "missileShieldPenetration": 1,
        "missileArmorPenetration": 2,
        "missileSpeed": 1,
        "missileRange": 6,
        "targetMovePerTurn": 0
      },
      "sideB": {
        "family": "kinetic",
        "doctrine": "standard",
        "accuracy": 20,
        "computerBonus": 10,
        "evasive": false,
        "reactorOutput": 5,
        "ammunition": 100,
        "missileGuidance": 55,
        "missileDamage": 5,
        "missileShieldPenetration": 1,
        "missileArmorPenetration": 2,
        "missileSpeed": 1,
        "missileRange": 6,
        "targetMovePerTurn": 0
      }
    },
    {
      "id": "wm-kk-r4",
      "label": "kinetic mirror range 4",
      "rangeHexes": 4,
      "sideA": {
        "family": "kinetic",
        "doctrine": "standard",
        "accuracy": 20,
        "computerBonus": 10,
        "evasive": false,
        "reactorOutput": 5,
        "ammunition": 100,
        "missileGuidance": 55,
        "missileDamage": 5,
        "missileShieldPenetration": 1,
        "missileArmorPenetration": 2,
        "missileSpeed": 1,
        "missileRange": 6,
        "targetMovePerTurn": 0
      },
      "sideB": {
        "family": "kinetic",
        "doctrine": "standard",
        "accuracy": 20,
        "computerBonus": 10,
        "evasive": false,
        "reactorOutput": 5,
        "ammunition": 100,
        "missileGuidance": 55,
        "missileDamage": 5,
        "missileShieldPenetration": 1,
        "missileArmorPenetration": 2,
        "missileSpeed": 1,
        "missileRange": 6,
        "targetMovePerTurn": 0
      }
    },
    {
      "id": "wm-kk-both-evm-r2",
      "label": "kinetic mirror both EvM",
      "rangeHexes": 2,
      "sideA": {
        "family": "kinetic",
        "doctrine": "standard",
        "accuracy": 20,
        "computerBonus": 10,
        "evasive": true,
        "reactorOutput": 5,
        "ammunition": 100,
        "missileGuidance": 55,
        "missileDamage": 5,
        "missileShieldPenetration": 1,
        "missileArmorPenetration": 2,
        "missileSpeed": 1,
        "missileRange": 6,
        "targetMovePerTurn": 0
      },
      "sideB": {
        "family": "kinetic",
        "doctrine": "standard",
        "accuracy": 20,
        "computerBonus": 10,
        "evasive": true,
        "reactorOutput": 5,
        "ammunition": 100,
        "missileGuidance": 55,
        "missileDamage": 5,
        "missileShieldPenetration": 1,
        "missileArmorPenetration": 2,
        "missileSpeed": 1,
        "missileRange": 6,
        "targetMovePerTurn": 0
      }
    },
    {
      "id": "wm-kk-a-evm-r2",
      "label": "kinetic mirror A EvM",
      "rangeHexes": 2,
      "sideA": {
        "family": "kinetic",
        "doctrine": "standard",
        "accuracy": 20,
        "computerBonus": 10,
        "evasive": true,
        "reactorOutput": 5,
        "ammunition": 100,
        "missileGuidance": 55,
        "missileDamage": 5,
        "missileShieldPenetration": 1,
        "missileArmorPenetration": 2,
        "missileSpeed": 1,
        "missileRange": 6,
        "targetMovePerTurn": 0
      },
      "sideB": {
        "family": "kinetic",
        "doctrine": "standard",
        "accuracy": 20,
        "computerBonus": 10,
        "evasive": false,
        "reactorOutput": 5,
        "ammunition": 100,
        "missileGuidance": 55,
        "missileDamage": 5,
        "missileShieldPenetration": 1,
        "missileArmorPenetration": 2,
        "missileSpeed": 1,
        "missileRange": 6,
        "targetMovePerTurn": 0
      },
      "pairId": "wm-kk-b-evm-r2"
    },
    {
      "id": "wm-kk-b-evm-r2",
      "label": "kinetic mirror B EvM",
      "rangeHexes": 2,
      "sideA": {
        "family": "kinetic",
        "doctrine": "standard",
        "accuracy": 20,
        "computerBonus": 10,
        "evasive": false,
        "reactorOutput": 5,
        "ammunition": 100,
        "missileGuidance": 55,
        "missileDamage": 5,
        "missileShieldPenetration": 1,
        "missileArmorPenetration": 2,
        "missileSpeed": 1,
        "missileRange": 6,
        "targetMovePerTurn": 0
      },
      "sideB": {
        "family": "kinetic",
        "doctrine": "standard",
        "accuracy": 20,
        "computerBonus": 10,
        "evasive": true,
        "reactorOutput": 5,
        "ammunition": 100,
        "missileGuidance": 55,
        "missileDamage": 5,
        "missileShieldPenetration": 1,
        "missileArmorPenetration": 2,
        "missileSpeed": 1,
        "missileRange": 6,
        "targetMovePerTurn": 0
      },
      "pairId": "wm-kk-a-evm-r2"
    },
    {
      "id": "wm-ee-r0",
      "label": "energy mirror range 0",
      "rangeHexes": 0,
      "sideA": {
        "family": "energy",
        "doctrine": "standard",
        "accuracy": 25,
        "computerBonus": 10,
        "evasive": false,
        "reactorOutput": 5,
        "ammunition": 100,
        "missileGuidance": 55,
        "missileDamage": 5,
        "missileShieldPenetration": 1,
        "missileArmorPenetration": 2,
        "missileSpeed": 1,
        "missileRange": 6,
        "targetMovePerTurn": 0
      },
      "sideB": {
        "family": "energy",
        "doctrine": "standard",
        "accuracy": 25,
        "computerBonus": 10,
        "evasive": false,
        "reactorOutput": 5,
        "ammunition": 100,
        "missileGuidance": 55,
        "missileDamage": 5,
        "missileShieldPenetration": 1,
        "missileArmorPenetration": 2,
        "missileSpeed": 1,
        "missileRange": 6,
        "targetMovePerTurn": 0
      }
    },
    {
      "id": "wm-ee-r2",
      "label": "energy mirror range 2",
      "rangeHexes": 2,
      "sideA": {
        "family": "energy",
        "doctrine": "standard",
        "accuracy": 25,
        "computerBonus": 10,
        "evasive": false,
        "reactorOutput": 5,
        "ammunition": 100,
        "missileGuidance": 55,
        "missileDamage": 5,
        "missileShieldPenetration": 1,
        "missileArmorPenetration": 2,
        "missileSpeed": 1,
        "missileRange": 6,
        "targetMovePerTurn": 0
      },
      "sideB": {
        "family": "energy",
        "doctrine": "standard",
        "accuracy": 25,
        "computerBonus": 10,
        "evasive": false,
        "reactorOutput": 5,
        "ammunition": 100,
        "missileGuidance": 55,
        "missileDamage": 5,
        "missileShieldPenetration": 1,
        "missileArmorPenetration": 2,
        "missileSpeed": 1,
        "missileRange": 6,
        "targetMovePerTurn": 0
      }
    },
    {
      "id": "wm-ee-r4",
      "label": "energy mirror range 4",
      "rangeHexes": 4,
      "sideA": {
        "family": "energy",
        "doctrine": "standard",
        "accuracy": 25,
        "computerBonus": 10,
        "evasive": false,
        "reactorOutput": 5,
        "ammunition": 100,
        "missileGuidance": 55,
        "missileDamage": 5,
        "missileShieldPenetration": 1,
        "missileArmorPenetration": 2,
        "missileSpeed": 1,
        "missileRange": 6,
        "targetMovePerTurn": 0
      },
      "sideB": {
        "family": "energy",
        "doctrine": "standard",
        "accuracy": 25,
        "computerBonus": 10,
        "evasive": false,
        "reactorOutput": 5,
        "ammunition": 100,
        "missileGuidance": 55,
        "missileDamage": 5,
        "missileShieldPenetration": 1,
        "missileArmorPenetration": 2,
        "missileSpeed": 1,
        "missileRange": 6,
        "targetMovePerTurn": 0
      }
    },
    {
      "id": "wm-ee-both-evm-r2",
      "label": "energy mirror both EvM",
      "rangeHexes": 2,
      "sideA": {
        "family": "energy",
        "doctrine": "standard",
        "accuracy": 25,
        "computerBonus": 10,
        "evasive": true,
        "reactorOutput": 5,
        "ammunition": 100,
        "missileGuidance": 55,
        "missileDamage": 5,
        "missileShieldPenetration": 1,
        "missileArmorPenetration": 2,
        "missileSpeed": 1,
        "missileRange": 6,
        "targetMovePerTurn": 0
      },
      "sideB": {
        "family": "energy",
        "doctrine": "standard",
        "accuracy": 25,
        "computerBonus": 10,
        "evasive": true,
        "reactorOutput": 5,
        "ammunition": 100,
        "missileGuidance": 55,
        "missileDamage": 5,